claim_id,claim,status,evidence,blockers,next_step
brain-001,The holographic brain surface is wired to a live evidence API,PARTIALLY OPERATIONAL,"static/3d/brain.html reads /api/a11oy/v1/holographic/brain/evidence; szl3d_holographic.py registers the route","display sculpting is local; not a model runtime","bind lobes to /api/a11oy/v1/brain/capabilities"
brain-002,The estate brain graph exists as a queryable graph,PARTIALLY OPERATIONAL,"a11oy_brain_graph.py and szl_brain_api.py expose graph/search/neighbors/community/subgraph/stats routes","graph is generated from committed/snapshot metadata, not continuous ingestion","add durable GitHub/Hugging Face/site event ingestion receipts"
brain-003,The brain has governed retrieval,PARTIALLY OPERATIONAL,"/api/a11oy/v1/brain/search and /api/a11oy/v1/brain/ask route through szl_brain_api; research/brain-evidence-admission/evidence-manifest.json binds a deterministic MEASURED_LOCAL_PILOT that szl_brain_evidence_eval.py replays byte-for-byte","hash embeddings and graph similarity are modeled; generated prose may be unavailable; the pilot is small, local, lexical-only, and has no established external validity","run the locked lexical/vector/graph/hybrid benchmark on an independent admitted corpus without generalizing the local pilot"
brain-004,The brain has memory freshness,PARTIALLY OPERATIONAL,"szl_brainmemory ranks graph nodes and degrades to STRUCTURAL-ONLY without real recency","memory is not yet an external durable event store","persist memory entries with signed or independently replayable receipts"
brain-005,Provenance and lineage are surfaced,PARTIALLY OPERATIONAL,"brain provenance/lineage routes read origin fields verbatim","not full model/build SLSA attestation","bind GitHub commits, HF SHAs, dataset SHAs, and deployment receipts per node"
brain-006,Query audit receipts prove durable operation,SIMULATED,"query audit and receipt endpoints emit hash-linked/unsigned content digests","audit is restart-ephemeral; digest is not a signature","move audit to durable storage and approved signing"
brain-007,LLM/router answer generation is live and weighted,SIMULATED,"szl_brain.py returns honest stubs without model backend evidence","no verified live model invocation or loaded-weight manifest in this ledger","create model availability endpoint with weight SHA and smoke-test receipt"
brain-008,All models are fully trained and weighted,UNAVAILABLE,"no reproducible training/eval receipt is present in this contract","cannot claim fully trained or fully weighted models without artifacts","publish training run receipts, eval metrics, licenses, and weight manifests"
